{
  "schemaVersion": "1.0",
  "id": "fragment:request_detail_pharmacy_v1",
  "documentType": "fragment",
  "node": {
    "type": "Column",
    "props": {
      "spacing": 8,
      "crossAxisAlignment": "stretch",
      "mainAxisSize": "min"
    },
    "slots": {
      "children": [
        {
          "type": "SectionCard",
          "visibleWhen": {
            "expr": "len(data.serviceDetails.order.items) > 0"
          },
          "props": {
            "title": "Items",
            "surface": "raised",
            "density": "compact",
            "titleVariant": "subtitle",
            "titleWeight": "semibold",
            "titleColor": "secondary",
            "contentGap": 10
          },
          "slots": {
            "child": [
              {
                "type": "ForEach",
                "props": {
                  "itemsPath": "serviceDetails.order.items"
                },
                "slots": {
                  "item": [
                    {
                      "type": "PharmacyRequestDetailCartItem",
                      "props": {
                        "title": "${item.name}",
                        "quantity": "${item.quantity}",
                        "unitPriceText": "${item.unitPriceText}",
                        "rxRequired": "${item.rxRequired}",
                        "surface": "flat",
                        "density": "compact"
                      }
                    },
                    {
                      "type": "Gap",
                      "visibleWhen": {
                        "expr": "index < len(data.serviceDetails.order.items) - 1"
                      },
                      "props": { "height": 2}
                    }
                  ]
                }
              }
            ]
          }
        },
        {
          "type": "CartSummary",
          "visibleWhen": {
            "expr": "data.serviceDetails.order.pricing != null && data.serviceDetails.order.pricing.total != null"
          },
          "props": {
            "title": "Summary",
            "linesPath": "serviceDetails.order.pricing.lines",
            "totalPath": "serviceDetails.order.pricing.total",
            "surface": "subtle"
          }
        },
        {
          "type": "SectionCard",
          "visibleWhen": {
            "expr": "len(data.serviceDetails.order.prescriptionAttachments) > 0"
          },
          "props": {
            "title": "Prescription",
            "surface": "subtle",
            "density": "compact",
            "titleVariant": "subtitle",
            "titleWeight": "semibold",
            "titleColor": "secondary",
            "contentGap": 10
          },
          "slots": {
            "child": [
              {
                "type": "ForEach",
                "props": {
                  "itemsPath": "serviceDetails.order.prescriptionAttachments"
                },
                "slots": {
                  "item": [
                    {
                      "type": "Text",
                      "props": {
                        "text": "${item.filename}",
                        "variant": "body",
                        "weight": "medium",
                        "color": "muted"
                      }
                    },
                    {
                      "type": "Gap",
                      "visibleWhen": {
                        "expr": "index < len(data.serviceDetails.order.prescriptionAttachments) - 1"
                      },
                      "props": { "height": 6 }
                    }
                  ]
                }
              }
            ]
          }
        }
      ]
    }
  }
}
