{
  "schemaVersion": "1.0",
  "id": "fragment:customer_requests_v1",
  "documentType": "fragment",
  "node": {
    "type": "RemoteQuery",
    "props": {
      "key": "customer.requests",
      "path": "/v1/requests"
    },
    "slots": {
      "loading": [
        {
          "type": "InfoCard",
          "props": {
            "title": "Activities",
            "subtitle": "Loading requests...",
            "surface": "subtle"
          }
        }
      ],
      "error": [
        {
          "type": "InfoCard",
          "props": {
            "title": "Activities",
            "subtitle": "Could not load requests.",
            "surface": "subtle"
          }
        }
      ],
      "child": [
        {
          "type": "Column",
          "props": {
            "spacing": 12,
            "crossAxisAlignment": "stretch",
            "mainAxisSize": "min"
          },
          "slots": {
            "children": [
              {
                "type": "If",
                "props": {
                  "valuePath": "has_requests",
                  "op": "isFalse"
                },
                "slots": {
                  "then": [
                    {
                      "type": "InfoCard",
                      "props": {
                        "title": "Activities",
                        "subtitle": "No requests yet.",
                        "surface": "subtle"
                      }
                    }
                  ]
                }
              },
              {
                "type": "If",
                "props": {
                  "valuePath": "attention",
                  "op": "isNotEmpty"
                },
                "slots": {
                  "then": [
                    {
                      "type": "Text",
                      "props": {
                        "text": "Needs attention",
                        "variant": "title",
                        "weight": "semibold"
                      }
                    },
                    {
                      "type": "ForEach",
                      "props": {
                        "itemsPath": "attention"
                      },
                      "slots": {
                        "item": [
                          {
                            "type": "BoundActionCard",
                            "props": {
                              "titlePath": "title",
                              "subtitlePath": "subtitle",
                              "iconPath": "icon",
                              "routePath": "route",
                              "surface": "raised"
                            }
                          },
                          {
                            "type": "Gap",
                            "props": { "height": 12 }
                          }
                        ]
                      }
                    }
                  ]
                }
              },
              {
                "type": "If",
                "props": {
                  "valuePath": "active",
                  "op": "isNotEmpty"
                },
                "slots": {
                  "then": [
                    {
                      "type": "Text",
                      "props": {
                        "text": "Active requests",
                        "variant": "title",
                        "weight": "semibold"
                      }
                    },
                    {
                      "type": "ForEach",
                      "props": {
                        "itemsPath": "active"
                      },
                      "slots": {
                        "item": [
                          {
                            "type": "BoundActionCard",
                            "props": {
                              "titlePath": "title",
                              "subtitlePath": "subtitle",
                              "iconPath": "icon",
                              "routePath": "route",
                              "surface": "raised"
                            }
                          },
                          {
                            "type": "Gap",
                            "props": { "height": 12 }
                          }
                        ]
                      }
                    }
                  ]
                }
              },
              {
                "type": "If",
                "props": {
                  "valuePath": "history",
                  "op": "isNotEmpty"
                },
                "slots": {
                  "then": [
                    {
                      "type": "Text",
                      "props": {
                        "text": "History",
                        "variant": "title",
                        "weight": "semibold"
                      }
                    },
                    {
                      "type": "ForEach",
                      "props": {
                        "itemsPath": "history"
                      },
                      "slots": {
                        "item": [
                          {
                            "type": "BoundActionCard",
                            "props": {
                              "titlePath": "title",
                              "subtitlePath": "subtitle",
                              "iconPath": "icon",
                              "routePath": "route",
                              "surface": "subtle"
                            }
                          },
                          {
                            "type": "Gap",
                            "props": { "height": 12 }
                          }
                        ]
                      }
                    }
                  ]
                }
              }
            ]
          }
        }
      ]
    }
  }
}