{
  "schemaVersion": "1.0",
  "id": "fragment:customer_home_notifications_v1",
  "documentType": "fragment",
  "node": {
    "type": "RemoteQuery",
    "props": {
      "key": "customer.notifications.homeSummary",
      "path": "/v1/notifications/home-summary"
    },
    "slots": {
      "loading": [
        {
          "type": "InfoCard",
          "props": {
            "title": "Updates",
            "subtitle": "Loading...",
            "surface": "subtle"
          }
        }
      ],
      "error": [
        {
          "type": "InfoCard",
          "props": {
            "title": "Updates",
            "subtitle": "Could not load updates.",
            "surface": "subtle"
          }
        }
      ],
      "child": [
        {
          "type": "CustomerHomeNotifications"
        }
      ]
    }
  }
}
